{"id":"HIST-004","title":"الموجة 4.1: مخطط تجربة المنتج","type":"RESEARCH","status":"VERIFIED","priority":"P2","stage":"completed","summary":"جرد الشاشات والرحلات والهيكل المستهدف والـwireframes دون تغيير التطبيق.","acceptance":["58 Route و14 رحلة و27 wireframe موثقة"],"areas":["product-ux-blueprint"],"contracts":[],"evidence":["reports/agent-report/2026-09-17_wave-4-1-product-ux-blueprint/report.md"],"dependencies":[],"owner_decision":"","merge_sha":"281a2878b61870792f76d651d0d822c7f0a5c0e1","verified_on_main_sha":"281a2878b61870792f76d651d0d822c7f0a5c0e1","updated_at":"2026-09-17","finding_classification":"NOT_APPLICABLE","finding_state":"NOT_APPLICABLE","root_cause":"control-record:HIST-004","source":{"report":"reports/agent-report/2026-09-17_wave-4-1-product-ux-blueprint/report.md","discovered_at_sha":"87ebcf2ffa74752bf385eff3a10962454b45d33e","evidence":["reports/agent-report/2026-09-17_wave-4-1-product-ux-blueprint/report.md"]},"status_history":[{"status":"VERIFIED","changed_at":"2026-09-19","actor":"migration:operations-control-v2","reason":"إضافة سجل الحالة عند ترحيل النظام إلى v2."}],"migration_baseline":true,"next_action":"لا إجراء؛ لا يُعاد فتحه إلا بدليل جديد وتصنيف REOPENED.","related_items":[],"classification":"HISTORICAL","owner":"Product owner / Manus coordination","tests_required":["Source/report comparison","Explicit unknowns and limits","Owner decision or pilot evidence"],"layers":["historical-evidence"]}
