{"id":"OPS-006","title":"تقادم ديون مبسط قبل الشرائح المتقدمة","type":"FEATURE","status":"READY","priority":"P2","stage":"stage-2","summary":"عرض مبسط لعمر الذمم والالتزامات القريبة قبل الحاجة إلى Aging رسمي 30/60/90، مع إبقاء التقادم المتقدم في BE-005 مؤجلًا.","finding_classification":"NEW_FINDING","finding_state":"CONFIRMED","root_cause":"plan-root:OPS-006","source":{"report":"https://github.com/Qays7753/Documents/tree/main/reports/2026/2026-09-19/layered-financial-management-audit-001","discovered_at_sha":"87ebcf2ffa74752bf385eff3a10962454b45d33e","evidence":["https://github.com/Qays7753/Documents/blob/main/reports/2026/2026-09-19/layered-financial-management-audit-001/gap-register.md"]},"acceptance":["تصنيف بسيط مفهوم للمستخدم الأساسي","لا ينشئ قيدًا أو حدثًا ماليًا","يميز نقص تاريخ الاستحقاق عن عدم وجود دين","اختبارات مصدر القراءة وحالات البيانات الناقصة","المسار المتقدم 30/60/90 يبقى BUILD_AFTER_EVIDENCE"],"areas":["receivables","payables","presentation"],"contracts":["docs/contracts/05-financial-p0-policies.md"],"evidence":["https://github.com/Qays7753/Documents/blob/main/reports/2026/2026-09-19/layered-financial-management-audit-001/gap-register.md"],"dependencies":["CTRL-001","OPS-001"],"related_items":["BE-005"],"owner_decision":"","merge_sha":"","verified_on_main_sha":"","updated_at":"2026-09-19","status_history":[{"status":"READY","changed_at":"2026-09-19","actor":"plan:operations-control-v2","reason":"إضافة تفصيل مرحلي من الخطة الكاملة قبل Pilot دون تنفيذ كودي."}],"migration_baseline":true,"next_action":"انتظر اعتماد CTRL-001 وCTRL-002 ثم أنشئ Workstream claim مستقلًا عند تحقق الاعتماديات.","classification":"FIX_BEFORE_PILOT","owner":"Product owner / Manus coordination","tests_required":["Domain/Service tests","DOM/Integration tests where UI is involved","Export/import or migration evidence where persistence changes","Merge and verification evidence on main"],"layers":["Layer 2","application","presentation"]}
