{"id":"HIST-002","title":"الموجة الثانية: الأساسات المالية والبيانية","type":"QUALITY","status":"VERIFIED","priority":"P1","stage":"completed","summary":"ثماني وحدات للمصروف والكاش والمالك والعكس والمخزون والتسوية والاستعادة.","acceptance":["EXE-007..014 مثبتة","التسوية وRound-trip ناجحان"],"areas":["finance","inventory","backup"],"contracts":[],"evidence":["reports/agent-report/2026-09-17_wave-2-financial-data-foundations/report.md"],"dependencies":[],"owner_decision":"","merge_sha":"81d8d253984dee410c7fd6c3e461fcd0e76f327e","verified_on_main_sha":"81d8d253984dee410c7fd6c3e461fcd0e76f327e","updated_at":"2026-09-17","finding_classification":"NOT_APPLICABLE","finding_state":"NOT_APPLICABLE","root_cause":"control-record:HIST-002","source":{"report":"reports/agent-report/2026-09-17_wave-2-financial-data-foundations/report.md","discovered_at_sha":"87ebcf2ffa74752bf385eff3a10962454b45d33e","evidence":["reports/agent-report/2026-09-17_wave-2-financial-data-foundations/report.md"]},"status_history":[{"status":"VERIFIED","changed_at":"2026-09-19","actor":"migration:operations-control-v2","reason":"إضافة سجل الحالة عند ترحيل النظام إلى v2."}],"migration_baseline":true,"next_action":"لا إجراء؛ لا يُعاد فتحه إلا بدليل جديد وتصنيف REOPENED.","related_items":[],"classification":"HISTORICAL","owner":"Product owner / Manus coordination","tests_required":["Focused automated tests","Failure/recovery path where applicable","Evidence on main or explicit device limitation"],"layers":["historical-evidence"]}
