{
  "id": "AREA-000",
  "title": "عنوان مباشر",
  "type": "FEATURE",
  "status": "BACKLOG",
  "priority": "P2",
  "stage": "pre-pilot",
  "summary": "المشكلة والنتيجة المطلوبة دون وصف حل مفترض.",
  "finding_classification": "NEW_FINDING",
  "finding_state": "UNVERIFIED",
  "classification": "FIX_BEFORE_PILOT",
  "root_cause": "",
  "owner": "Product owner / Manus coordination",
  "tests_required": ["اختبار قابل للتنفيذ"],
  "layers": ["domain", "application", "presentation"],
  "source": {"report": "path-or-url", "discovered_at_sha": "FULL_SHA", "evidence": []},
  "acceptance": ["معيار قابل للاختبار"],
  "areas": ["path-or-domain"],
  "contracts": [],
  "evidence": [],
  "dependencies": [],
  "related_items": [],
  "owner_decision": "",
  "merge_sha": "",
  "verified_on_main_sha": "",
  "updated_at": "2026-09-19",
  "status_history": [{"status": "BACKLOG", "changed_at": "2026-09-19", "actor": "agent/session", "reason": "سبب إنشاء البند."}],
  "migration_baseline": false,
  "next_action": "أول خطوة قابلة للتحقق"
}
