{"id":"OPS-005","title":"سطح قادم موحد للدفعات والتحصيلات والطلبات والالتزامات","type":"FEATURE","status":"READY","priority":"P1","stage":"stage-2","summary":"قراءة موحدة لما هو قادم وما تأخر عبر الدفعات والتحصيلات والطلبات والالتزامات، دون Writer جديد أو خلط المتوقع بالحدث المسجل.","finding_classification":"NEW_FINDING","finding_state":"CONFIRMED","root_cause":"plan-root:OPS-005","source":{"report":"https://github.com/Qays7753/Documents/tree/main/reports/2026/2026-09-19/layered-financial-management-audit-001","discovered_at_sha":"87ebcf2ffa74752bf385eff3a10962454b45d33e","evidence":["https://github.com/Qays7753/Documents/blob/main/reports/2026/2026-09-19/layered-financial-management-audit-001/gap-register.md"]},"acceptance":["مصدر قراءة واحد مع تعريف واضح لكل نوع موعد","المجهول لا يتحول إلى تاريخ اليوم أو صفر","التأخير ظاهر بعبارة صادقة ومصدره معروف","اختبارات القراءة والفشل الجزئي والتاريخ المحلي","لا يغير أي سجل مالي عند فتح السطح"],"areas":["schedule","cash","orders","payables","presentation"],"contracts":["docs/contracts/05-financial-p0-policies.md"],"evidence":["https://github.com/Qays7753/Documents/blob/main/reports/2026/2026-09-19/layered-financial-management-audit-001/gap-register.md"],"dependencies":["CTRL-001","OPS-001"],"related_items":["V-003"],"owner_decision":"","merge_sha":"","verified_on_main_sha":"","updated_at":"2026-09-19","status_history":[{"status":"READY","changed_at":"2026-09-19","actor":"plan:operations-control-v2","reason":"إضافة تفصيل مرحلي من الخطة الكاملة قبل Pilot دون تنفيذ كودي."}],"migration_baseline":true,"next_action":"انتظر اعتماد CTRL-001 وCTRL-002 ثم أنشئ Workstream claim مستقلًا عند تحقق الاعتماديات.","classification":"FIX_BEFORE_PILOT","owner":"Product owner / Manus coordination","tests_required":["Domain/Service tests","DOM/Integration tests where UI is involved","Export/import or migration evidence where persistence changes","Merge and verification evidence on main"],"layers":["Layer 2","application","presentation"]}
