{"id":"CTRL-001","title":"اعتماد Operations Control v2","type":"GOVERNANCE","status":"IN_REVIEW","priority":"P1","stage":"stage-0","summary":"ترقية نظام operations القائم إلى سجل منظم قابل للتحقق دون إنشاء مصدر حقيقة موازٍ.","acceptance":["التحقق الآلي ينجح","لا تعارض بين مصادر السلطة","PR مراجعة دون دمج تلقائي"],"areas":["docs/operations","AGENTS.md","CI"],"contracts":[],"evidence":["docs/operations/control/README.md"],"dependencies":[],"owner_decision":"اعتماد النظام بعد مراجعة المالك وAgent مستقل.","merge_sha":"","verified_on_main_sha":"","updated_at":"2026-09-19","finding_classification":"NOT_APPLICABLE","finding_state":"NOT_APPLICABLE","root_cause":"control-record:CTRL-001","source":{"report":"docs/operations/control/README.md","discovered_at_sha":"87ebcf2ffa74752bf385eff3a10962454b45d33e","evidence":["docs/operations/control/README.md"]},"status_history":[{"status":"IN_REVIEW","changed_at":"2026-09-19","actor":"migration:operations-control-v2","reason":"إضافة سجل الحالة عند ترحيل النظام إلى v2."}],"migration_baseline":true,"next_action":"استكمل مراجعة المالك والمراجع المستقل ثم حدّث الحالة في PR نفسه.","related_items":[],"classification":"GOVERNANCE","owner":"Product owner / Manus coordination","tests_required":["Validator/schema test","Generated-view freshness check","Owner review evidence"],"layers":["governance","documentation"]}
