{"id":"OPS-001","title":"المواعيد والاستحقاقات وتقادم الذمم الأساسي","type":"FEATURE","status":"READY","priority":"P1","stage":"stage-2","summary":"تسجيل dueOn وموعد التحصيل/الدفع وعرض تقادم مبسط دون تحويل التاريخ المجهول إلى اليوم أو الصفر.","acceptance":["كل سجل استحقاق/موعد يحفظ التاريخ المحلي أو يصرح بأنه غير محدد","التقادم الأساسي يميز الحالي والمتأخر دون اختراع تاريخ","لا تغيير في Writer مالي قائم ولا في Cost Snapshot التاريخية","اختبارات Domain وDOM ومسار فشل للموعد المفقود"],"areas":["work","receivables","payables"],"contracts":[],"evidence":[],"dependencies":["CTRL-001"],"owner_decision":"","merge_sha":"","verified_on_main_sha":"","updated_at":"2026-09-19","finding_classification":"NOT_APPLICABLE","finding_state":"NOT_APPLICABLE","root_cause":"control-record:OPS-001","source":{"report":"docs/operations/control/README.md","discovered_at_sha":"87ebcf2ffa74752bf385eff3a10962454b45d33e","evidence":[]},"status_history":[{"status":"READY","changed_at":"2026-09-19","actor":"migration:operations-control-v2","reason":"إضافة سجل الحالة عند ترحيل النظام إلى v2."}],"migration_baseline":true,"next_action":"تحقق من الاعتماديات (CTRL-001) ثم أنشئ Workstream claim قبل التنفيذ.","related_items":[],"classification":"FIX_BEFORE_PILOT","owner":"Product owner / Manus coordination","tests_required":["Domain/Service tests","DOM/Integration tests where UI is involved","Export/import or migration evidence where persistence changes","Merge and verification evidence on main"],"layers":["Layer 2","application","presentation"]}
