{"id":"G-005","title":"عزل فشل قراءات صفحة المالية","type":"DEFECT","status":"REVIEW_REQUIRED","priority":"P2","stage":"audit-2026-09-19","summary":"فشل قراءة واحدة من 12 مصدرًا قد يحجب صفحة المالية كاملة.","finding_classification":"NEW_FINDING","finding_state":"CONFIRMED","root_cause":"control-record:G-005","source":{"report":"https://github.com/Qays7753/Documents/tree/main/reports/2026/2026-09-19/layered-financial-management-audit-001","discovered_at_sha":"87ebcf2ffa74752bf385eff3a10962454b45d33e","evidence":["https://github.com/Qays7753/Documents/blob/main/reports/2026/2026-09-19/layered-financial-management-audit-001/gap-register.md","https://github.com/Qays7753/Documents/blob/main/reports/2026/2026-09-19/layered-financial-management-audit-001/scenario-results.md"]},"acceptance":["الدليل محفوظ ومربوط بالمصدر","لا إعلان VERIFIED قبل إصلاح/قرار موثق واختبار على main"],"areas":["finance","read-availability"],"contracts":[],"evidence":["https://github.com/Qays7753/Documents/blob/main/reports/2026/2026-09-19/layered-financial-management-audit-001/gap-register.md","https://github.com/Qays7753/Documents/blob/main/reports/2026/2026-09-19/layered-financial-management-audit-001/scenario-results.md"],"dependencies":[],"related_items":[],"owner_decision":"","merge_sha":"","verified_on_main_sha":"","updated_at":"2026-09-19","status_history":[{"status":"REVIEW_REQUIRED","changed_at":"2026-09-19","actor":"audit-import:2026-09-19","reason":"استيراد من تدقيق الإدارة المالية المتدرجة أو بوابة التشغيل السابقة."}],"migration_baseline":true,"next_action":"تقييم خطر القراءة ثم إنشاء Claim للتجزئة إذا أقر المالك النطاق.","classification":"FIX_BEFORE_PILOT","owner":"Product owner / Manus coordination","tests_required":["Domain/Service tests where the invariant is owned","DOM/Integration test for the affected journey","Live scenario with before/after evidence","Retry, partial failure, concurrency, or stale-read test as applicable","No regression in existing financial calculations","Merge and verification evidence on main"],"layers":["cross-layer"]}
